{"attempt_no":1,"audio_refs":[],"conversation_ref":{"artifact_id":"fe0b1ce3-f461-5dad-a1cc-babfe85fcbe3","kind":"conversation","mime":"application/x-ndjson","sha256":"f3b525f7eace5d943781959bd79ded596fc06d6014d74ea70022c2fd8269ff1f","size_bytes":"305"},"environment_audit_ref":{"artifact_id":"cfbf4303-00b4-5be9-9c5c-e4ec83c83303","kind":"environment_audit","mime":"application/x-ndjson","sha256":"9f7d19dee4b9690f9db380e227845d11d3a43536e47c0f55dd9f9f8dfac0faf5","size_bytes":"305"},"environment_snapshot_ref":{"artifact_id":"0dd95c52-35bf-557e-b242-5bbdaa00b431","kind":"environment_snapshot","mime":"application/json","sha256":"d288d9c0cef0ad427e40561683f0fb6c12ff28fd4c14559656f70e39dd24ea60","size_bytes":"305"},"execution_status":"executed","project_id":"6c8c58d8-6fb6-5fa0-acf6-4cea25535630","run_id":"a278e53f-0099-50a5-acda-e1189d2bf6cc","schema_version":1,"seed":42,"session_id":"4a210cb8-0311-5192-92ad-baa19c0857d8","termination_reason":"completed","timestamps":{"finished_at":"2026-10-29T10:01:00Z","started_at":"2026-10-29T10:00:00Z"},"tool_calls_ref":{"artifact_id":"3accf738-d308-50f7-b5b8-61f7a08ac03b","kind":"tool_calls","mime":"application/x-ndjson","sha256":"4eafc647e7f5344e6f9e0605c8dcf1c7f1738790cce983ce29065d14f492d317","size_bytes":"305"},"usage":{"audio_ms":0,"input_tokens":0,"output_tokens":0},"versions":{"agent_version_id":"90f52ccc-d70c-5ad1-842f-7c5ffd25f441","environment_version_id":"a66b80da-62e4-548f-9408-8baa355cd057","evaluator_version_id":"ddca77af-ab2c-511d-b02c-62c80f9b96d9","scenario_version_id":"b36f2060-2e8e-50fd-82b0-e93a303bbb78","simulator_version_id":"e16e69ff-cf53-56ea-969a-04344c821f85"}}
